{
  "$schema": "http://json-schema.org/draft-07/schema#",
  "title": "Producer OS Configuration",
  "description": "Schema for Producer OS configuration file.",
  "type": "object",
  "properties": {
    "inbox_path": {
      "type": "string",
      "description": "Path to the inbox directory (current GUI/runtime key)"
    },
    "hub_path": {
      "type": "string",
      "description": "Path to the hub/destination directory (current GUI/runtime key)"
    },
    "inbox": {
      "type": "string",
      "description": "Path to the inbox directory (legacy key; inbox_path is preferred)"
    },
    "hub": {
      "type": "string",
      "description": "Path to the hub directory (legacy key; hub_path is preferred)"
    },
    "output_folder_name": {
      "type": "string",
      "description": "Name of the organized folder created inside the destination root (for example, Hub or Outbox)"
    },
    "action": {
      "type": "string",
      "enum": ["move", "copy"],
      "description": "Default transfer mode"
    },
    "dry_run": {
      "type": "boolean",
      "description": "Whether the GUI/CLI should default to dry-run behavior"
    },
    "preserve_vendor": {
      "type": "boolean",
      "description": "Whether to preserve vendor/pack folder structure when organizing"
    },
    "file_types": {
      "type": "object",
      "description": "Enabled file types for GUI processing",
      "properties": {
        "wav": {"type": "boolean"},
        "mp3": {"type": "boolean"},
        "flac": {"type": "boolean"}
      },
      "additionalProperties": true
    },
    "loop_safety": {
      "type": "boolean",
      "description": "Whether loop routing safety is enabled"
    },
    "theme": {
      "type": "string",
      "description": "UI theme preset (system, studio_dark, paper_light, midnight_blue; dark/light aliases still load)"
    },
    "ui_density": {
      "type": "string",
      "enum": ["comfortable", "compact"],
      "description": "UI density mode for spacing and table layout"
    },
    "ui_accent_mode": {
      "type": "string",
      "enum": ["theme_default", "preset", "custom"],
      "description": "Accent color source mode"
    },
    "ui_accent_preset": {
      "type": "string",
      "enum": ["cyan", "blue", "emerald", "amber", "rose"],
      "description": "Accent preset id when ui_accent_mode is preset"
    },
    "ui_accent_color": {
      "type": "string",
      "pattern": "^#?[0-9A-Fa-f]{6}$",
      "description": "Custom accent color (#RRGGBB) when ui_accent_mode is custom"
    },
    "ignore_rules": {
      "type": "array",
      "items": {"type": "string"},
      "description": "List of file or folder names/prefixes to ignore"
    },
    "normalize_pack_name": {
      "type": "boolean",
      "description": "Whether to normalize pack names when sorting"
    },
    "portable_mode": {
      "type": "boolean",
      "description": "Override to enable portable mode"
    },
    "normalize_pack_name": {
      "type": "boolean",
      "description": "Whether to normalize pack names when sorting"
    },
    "developer_tools": {
      "type": ["boolean", "object"],
      "description": "Developer options such as verbose logging",
      "additionalProperties": true
    }
  },
  "additionalProperties": true
}
